keyword,location,text,target
radiation emergency,canada,liked youtube video canada radiation update emergency fishing closures,1
radiation emergency,NaN,wipe emergency activated slightly elevated levels radiation senor,1
radiation emergency,vermont,worst radiation exposure fukushima meltdown happened km northwestproof small emergency planning zones dont cut,1
radiation emergency,louisiana,wipe facility investigating site filter radiation reading activated emergency ops center says offsite release,0
radiation emergency,NaN,radioactive box quarantined israels shod port evacuated emergency teams discovered radiation emitting,1
radiation emergency,washington,radiation emergency preparedness starts knowing inside stay inside stay tuned cdcgov,1
radiation emergency,NaN,wants documents radiation emergency procedures radiation emergency procedures ,0
radiation emergency,NaN,clot cot radiation nuclear emergency tracking center,0
rainstorm,prince edward island,rainstorm night cupcake decorating happening rec hall proceeds ink,0
rainstorm,massachusetts,rainstorm downtown gloucester gloucester captain seagulls triciaoneill triciaoneillphoto,1
rainstorm,NaN,myrtlegroggins ltgaspgt forgot sunday omg,0
rainstorm,alberta,wow beauty lies storm taken today rainstorm camp pipelines,1
rainstorm,yobe state,rainstorm destroys houses robe state rainstorm destroys houses robe state daily trust damage,1
rainstorm,rhode island,going beach jim alves means guaranteed rainstorm lucky,0
rainstorm,NaN,dna newrelease edge jimmy summer rainstorm papaya sounds,0
rainstorm,united states of america,people killed severe rainstorm italian alps caused landslide,1
rainstorm,NaN,landslide italian alps kills rome reuters people killed severe rainstorm,1
rainstorm,NaN,rainstorm destroys houses robe reporter havethis,1
rainstorm,la puente,stuck rainstorm stay middle road streets crowned water tends pool sides,0
rainstorm,NaN,major rainstorm happening im going lie drift away storming little bebacksoon,1
rainstorm,NaN,landslide italian alps kills rome reuters people killed severe rainstorm,1
rainstorm,memphis,roar waves rainstorm amp rolling,0
rainstorm,NaN,robotrainstorm vacancies castle fantasy football team join fun,0
rainstorm,NaN,calumsos look like got caught rainstorm amazing disgusting time,0
rainstorm,NaN,rainstorm update north south,1
rainstorm,thailand,nigeria rainstorm destroys houses robe state daily trust damaturu ,1
rainstorm,NaN,landslide italian alps kills rome reuters people killed severe rainstorm,1
rainstorm,pennsylvania,rain rain away soaker way,0
rainstorm,NaN,nathanfillion hardly,0
rainstorm,fairfax,tomorrows evening commute receives red light rainstorm impacting region push way late evening,1
rainstorm,memphis,rainstorm nearly long,1
rainstorm,seattle,robotrainstorm import interested fonts,0
rainstorm,british columbia,lizzie cstsmith drove deep water flash floodrainstorm repair cost yrs later people think cars float,1
rainstorm,NaN,best believe wrong decisions memphis streets rainstorm lol folk doe,0
rainstorm,bridport,want rainstorm,0
rainstorm,NaN,waking sick rainstorm outside usually sad today kooks stereo let,0
rainstorm,north vancouver,yay feel wind gearing rainstorm vancouver bring drought deadgrassandflowers wildfires,1
rainstorm,seattle,robotrainstorm im huge football fan know ive fantasy leagues patience newbie,0
rainstorm,pioneer village,way like rainstorm im house cards,1
rainstorm,nigeria,rainstorm destroys houses robe state,1
rainstorm,NaN,way like rainstorm im house cards,0
rainstorm,uk,landslide caused severe rainstorm kills italianalps,1
razed,NaN,freedom surfs razed way new homes,0
razed,NaN,latest homes razed northern california wildfire abc news,1
razed,nigeria,tension asia ine offices razed governor ikpeazu pop aga react,1
razed,california,latest homes razed northern california wildfire latest wildfires burning california,1
razed,NaN,latest homes razed northern california wildfire,1
razed,NaN,latest homes razed northern california wildfire abc news,1
razed,NaN,latest homes razed northern california wildfire abc news,1
razed,NaN,latest homes razed northern california wildfire lynchburg news advance,1
razed,NaN,news latest homes razed northern california wildfire new york times tabs fb,1
razed,NaN,latest homes razed northern california wildfire abc news,1
razed,NaN,latest homes razed northern california wildfire abc news,1
razed,NaN,latest homes razed northern california wildfire,1
razed,NaN,latest homes razed northern california wildfire,1
razed,NaN,latest homes razed northern california wildfire,1
razed,NaN,petereallen huffpostuk bbclive significant think iconic pic church maybe ruins substantial efforts razed,0
razed,NaN,latest homes razed northern california wildfire,1
razed,NaN,latest homes razed northern california wildfire,1
razed,NaN,latest homes razed northern california wildfire abc news,1
razed,iowa,davidvonderhaar sincere,1
razed,NaN,latest homes razed northern california wildfire abc news,1
razed,NaN,latest homes razed northern california wildfire abc news,1
razed,NaN,latest homes razed northern california wildfire,1
razed,california,homes razed northern calf wildfire santiago,1
razed,nairobi,george jenga hero saved burning friend razing wildfire,1
razed,pennsylvania,today dualism amazed enjoyed yesterdays check todays easter,0
razed,NaN,latest homes razed northern california wildfire abc news,1
razed,NaN,latest homes razed northern california wildfire abc news,1
razed,NaN,latest homes razed northern california wildfire abc news,1
razed,NaN,latest homes razed northern california wildfire abc news,1
razed,NaN,latest homes razed northerncalifornia wildfire zippednews,1
razed,NaN,latest homes razed northern california wildfire,1
razed,nairobi,george jenga hero saved burning friend razing wildfire,1
razed,NaN,latest homes razed northern california wildfire,1
razed,NaN,latest homes razed northern california wildfire abc news,1
razed,augusta,vassalboro house razed way public gazebo petelmcguire reports,0
refugees,NaN,justmarried turkish couple gave syrian refugees incredible gift fed instead family amp friends,1
refugees,poland,police monitoring jihadis poland freedomoutpost,1
refugees,aurora,turkish newlyweds donate wedding money beautiful gesture faith humanity,0
refugees,NaN,justmarried turkish couple gave syrian refugees incredible gift washingtonpost,1
refugees,colorado,repulsive refugeesvictimiserdutton evangelicalliarabbott co lap dupe press overdrive choppergatebronwynbishopauspol,0
refugees,NaN,retweet cameroon repatriating nigerian refugees boko haram,1
refugees,us,newlyweds feed syrian refugees wedding abc news latest canada world entertainment business news,0
refugees,NaN,wow nigerian refugees repatriated cameroon,1
refugees,NaN,nigerian refugees repatriated cameroon,1
refugees,NaN,nigerian refugees repatriated cameroon,1
refugees,NaN,imagine entire aisle dedicated making people look like serbian refugees director foods clothing section,0
refugees,NaN,viralspell couple spend wedding day feeding syrian refugees,0
refugees,NaN,read nigerian refugees repatriated cameroon,1
refugees,NaN,story viralspell couple spend wedding day feeding syrian refugees,0
refugees,NaN,refugee connections indiegogo campaign going live tomorrow support help launch online community refugees,1
refugees,NaN,read nigerian refugees repatriated cameroon,1
refugees,NaN,short throwing overboard think leader worse refugees tonyabbottmhr worst,1
refugees,NaN,cameroon repatriated nigerian refugees,1
refugees,NaN,captain abbott lap boat refugees christianvalues,0
refugees,NaN,turkish couple spent wedding day feeding syrian refugees turkish couple got marrie,0
refugees,NaN,couple drones save refugees worlds deadliest border,1
refugees,NaN,nigerian refugees repatriated cameroon,1
refugees,NaN,nigerian refugees repatriated cameroon,1
refugees,bangalore,turkish couple decided feed syrian refugees wedding celebrations,0
refugees,south radcliffe village,fadelurker dalinthanelan right years refugees camped south radcliffe village aidan,1
refugees,australia,newlyweds feed thousands syrian refugees instead hosting banquet wedding dinner age news,0
refugees,amman,photos young refugees forced flee burundis violence vice news,1
refugees,tripoli,kristindavis un refugees thank un refugees helping people need world,0
refugees,NaN,wow nigerian refugees repatriated cameroon,0
refugees,NaN,newlyweds feed thousands syrian refugees instead hosting banquet wedding dinner suh,1
refugees,australia,panic media centre articles australia ref protests new security gag reporting,0
refugees,NaN,recap nigerian refugees repatriated cameroon,1
refugees,us,generous bride earth couple feeds syrian refugees wedding day thedailybeast love,0
refugees,NaN,nigerian refugees repatriated cameroon,1
refugees,NaN,returned refugees fleeing amp vietnamese govt treat returned dutton presser,1
refugees,paris,chose refugees followers paris visit dream humanity exhibition rezaphotography,1
rescue,NaN,policyholders object click rescue plan,1
rescue,NaN,panic kelbytomlinson rescue,0
rescue,animalrescue,coastal german shepherd rescue oc shared link animalrescue,0
rescue,road york,ud rescue structural collapse scott road ypres road york trucks,1
rescue,new jersey,rescue day world cat day saturday aug ith black blackwhite cats newbeginningsanimalrescue,0
rescue,NaN,im blood pressure meds probably roof long pact story broke involved animal rescue,0
rescue,animalrescue,coastal german shepherd rescue oc shared link animalrescue,0
rescue,NaN,coastal german shepherd rescue oc shared link ecstatic rescued rocco animalrescue,0
rescue,NaN,uggs amp vivian rescue psychrewatch,0
rescue,sydney,lengths rescue cat need,0
rescue,oklahoma,chance animal rescue new posts animalrescue,0
rescue,NaN,chance animal rescue new posts animalrescue,0
rescue,NaN,sammy todd rescue uniform rescue lao forever ufc fam,0
rescue,NaN,lunch crew night night long day peaceloverescue,0
rescue,colorado,tell united nations plantations forests rainforestresq,0
rescue,NaN,mary coming troy rescue,0
rescue,road york,ud rescue structural collapse scott road ypres road york trucks,1
rescue,NaN,floodzone general raheem sharif visits chital lauded efforts army troops army aviation rescue opera,1
rescue,NaN,chance animal rescue new posts animalrescue,0
rescue,NaN,lisavanderpump dogs rescue dogs,0
rescue,india,officials rescue migrants libya bodies found fox news news,1
rescue,animalrescue,coastal german shepherd rescue oc shared link animalrescue,0
rescued,united states,zakbagans sabrina dad rescued dude kept cage ,1
rescued,NaN,britons rescued amid himalayan floods,1
rescued,nigeria, kidnapped ladies rescued police nigerian tribune,1
rescued,jakarta,rescued med migrants arrive sicily,1
rescued,ohio,tennoatax hand glass water sit rescued tengo ive lived ship dojo year,0
rescued,NaN,trust rescued dopey ones val hilarious shame probably going die emmerdale,0
rescued,california,summer summervibes california puppy pitmix rescued braxton banks happy babies,0
rescued,NaN,man buried dog alive thought find rescued time,0
rescued,canada,monthold baby girl rescued coastguard floated half mile sea socialnews,1
rescued,NaN,skim awaits rescuedagain,0
rescued,NaN,rescued med migrants arrive sicily,1
rescued,NaN,finnish hip hop pioneer paleface rescued drifting raft brought container later enkelbiljett menolippu,0
rescued,NaN, bovines rescued smugglersnabbed,1
rescued,NaN,funds needed rescued abandoned cocker spaniels,0
rescued,NaN,liked youtube video romanatwoodvlogs rescued sick kittens,0
rescued,NaN,news britons rescued amid himalayan floods,1
rescued,NaN,brave little dog gets rescued river recovery insei youtube,0
rescued,philadelphia,homeless man traveling usa stray dogs rescued gets helping hand strangers reshareworthy,0
rescued,NaN,brittanypetko breaking news tonight kids rescued play room week food water parents sex life haha,1
rescued,winston-salem,rescued actually pretend giorgio hyatt,0
rescued,illinois,rescued dog years ago old sweet zakbagans,0
rescued,NaN,rescued med migrants arrive sicily hundreds migrants rescued,1
rescued,NaN,taken africa rescued news,1
rescued,libya,migrants rescued boat capsizes libya,1
rescued,libya,young children rescued capsized boat libya irishtimesworld,1
rescued,NaN,heroes springer spaniel amp dog dad rescued stranded baby dolphin,1
rescued,leeds,trust rescued dopey ones emmerdale summerfate,0
rescued,ireland,beached whales rescued kerry,1
rescued,NaN,rescued goes ribbon hits offtrackhorse,0
rescued,NaN,turn rescued swept away sins clouds isaiah contemporary english version,0
rescued,pennsylvania,zakbagans pets like family love animals pets rescued breaks heart animals mistreated,0
rescued,boston,liked youtube video homeless dog living cardboard box gets rescued amp heartwarming,0
rescued,canada,angry mistrustful rescued elephant finds peace friendship new home photos onegreenplanet,0
rescued,palermo,photo hundreds rescued migrants await disembarkment irish naval vessel palermo italy tconnellyr,1
rescued,NaN,rescued med migrants arrive sicily,1
rescuers,nigeria,video picking bodies water rescuers searching hundreds migrants africa news,1
rescuers,NaN,video picking bodies water rescuers searching hundreds migrants mediterran,1
rescuers,kuala lumpur,video picking bodies water rescuers searching hundreds migrants mediterran,1
rescuers,NaN,video picking bodies water rescuers searching hundreds migrants mediterran,1
rescuers,NaN,video picking bodies water rescuers searching hundreds migrants mediterranean,1
rescuers,NaN,world fears missing migrants med rescuers search survivors boat carrying news,1
rescuers,NaN,durbanknight rescuers searching hundreds migrants mediterranean boat carr nose,1
rescuers,NaN,unexplainable desire watch rescuers childhooddefined,0
rescuers,massachusetts,roddypiperautos fears missing migrants med rescuers search survivors boat carrying ma,1
rescuers,NaN,andygilder channel spa dog rescuersthe infomercial crept door,0
rescuers,NaN,video picking bodies water rescuers searching hundreds migrants mediterranean boat carry,1
rescuers,marin county,womans gas app guides rescuers injured biker marin county,1
rescuers,NaN,video picking bodies water rescuers searching hundreds migrants mediterran,1
rescuers,london,video picking bodies water rescuers searching hundreds migrants mediterran,1
rescuers,NaN,video picking bodies water rescuers searching hundreds migrants mediterranean boat carry,1
rescuers,NaN,video picking bodies water rescuers searching hundreds migrants africa news,1
rescuers,NaN,second ebay bid shaolin rescuers shen chan nan chiang venoms kung fu favor,0
rescuers,NaN,video picking bodies water rescuers searching hundreds migrants mediterranean boat carry,1
rescuers,NaN,worldnews video picking bodies water bac news home rescuers searching hundreds,1
rescuers,thailand,video picking bodies water rescuers searching hundreds migrants mediterran,1
rescuers,NaN,video picking bodies water rescuers searching hundreds,1
rescuers,NaN,amazing story power animal rescuers starving homeless dog future rescued person,1
rescuers,NaN,rescuers searching hundreds migrants mediterranean boat carrying people capsized coast,1
rescuers,washington,news deaths shipwreck rescuers trying save hundreds migrants thenewshype,1
rescuers,NaN,video picking bodies water rescuers searching hundreds migrants mediterran,1
rescuers,NaN,video picking bodies water rescuers searching hundreds migrants mediterran,1
rescuers,phoenix,rescuers found barely alive idea allergic,1
rescuers,NaN,fears missing migrants med rescuers search survivors boat carrying migrant,1
rescuers,NaN,video picking bodies water rescuers searching hundreds migrants mediterranean boat carry,1
rescuers,marin county,womans gas app guides rescuers injured biker marin county state,1
rescuers,NaN,fears missing migrants med rescuers search survivors boat carrying migrants,1
rescuers,NaN,rescuers find survivors nepal earthquake buried,1
rescuers,paris,rescuers recover body yearold calgary man lake near vulcan,1
rescuers,NaN,fears missing migrants med rescuers search survivors boat carrying migrants,1
rescuers,NaN,video picking bodies water rescuers searching hundreds migrants bac news,1
riot,belgrade,meatloving feminists world riot grill arrived pop quiz prefer fem art,0
riot,india,stuart broad takes joe root runs riot aussies,0
riot,uk,piprhys predict riot,1
riot,NaN,teamvodg discovered nickcannon listenbuy realmandyrain riot itunesmusic itunes blowmandyup,0
riot,NaN,meatloving feminists world riot grill arrived arts,0
riot,atlantic city,rascal flatts riot tour atlantic city beach concertaugust tickets,0
riot,NaN,meatloving feminists world riot grill hasarrived,0
riot,uppsala,seriously tactical riot headquarters disney marvel,0
riot,NaN,antiriot eye looking lots new team members coming daysweeks,0
riot,detroit,meatloving feminists world riot grill arrived pop quiz prefer feminist,0
riot,NaN,liveworkshop selfie booth riot kappa,1
riot,acaciapenn,acaciapenn start big ass riot send jail today ifs skidded,0
riot,NaN,riot kit bah new concept gear coming autumnwinter menswear fashion urbanfashion,0
riot,NaN,abrancaballero discovered nickcannon listenbuy realmandyrain riot itunesmusic itunes blowmandyup,0
riot,NaN,liked youtube video thorns thoughts riot sandbox mode lol,0
riot,NaN,stuart broad takes joe root runs riot aussies stuart broad took careerist figures ,0
riot,los angeles,retweeted sarah silverman sarahksilverman soundtrack walk starts tracey ullman know perfect,0
riot,NaN,meatloving feminists world riot grill arrived,1
riot,NaN,time riot official satan teems skin,0
riot,montana,liked youtube video sick riot shield slide spots,0
riot,utah,bytorrecilla torrecilla info secret lol game check secret riot points bio,0
riot,kentucky,transwomen drag queens color lead riot known butch lesbian usually credited inciting,0
riot,los angeles,macau preorder film itunes amp watch yay,0
riot,united kingdom,ally near use skill hired making riot staff member look incompetent,0
riot,indiana,pop quiz prefer feminist revolution fried ravioliwith porcini ricotta,0
riot,NaN,meatloving feminists world riot grill arrived oliviamiles,0
riot,galway,davidjordan stephanenny know started riot makes sense credit particular individuals,1
riot,los angeles,trollkrattos juan carlos salvador secret tips riot points lol check secret bio,0
riot,idaho,southeast dirt riot series crowns champions southeast dirt riot series crowns championsblackfoot id,0
riot,NaN,sweetness running riot allotment brightening rainy day,1
riot,mumbai,stuart broad takes joe root runs riot aussies,0
riot,NaN,riot police intervene southampton finesse archer supporters clash fans clash buildup second,1
riot,NaN,jwalkerlyle discovered nickcannon listenbuy realmandyrain riot itunesmusic itunes blowmandyup,0
riot,san francisco,cracker white riot downplaying,0
rioting,NaN,government care police stop rioting eventually protestors eventually skyscrapers plantcovered,1
rioting,santa sports ireland,new dock tonight santa sports ireland review largest police presence soccer game ireland stop prevent rioting,0
rioting,NaN,eric clapton shot sheriff guess people rioting right,1
rioting,NaN,kill val im rioting emmerdale,0
rioting,NaN,money buy happiness lie tell poor people rioting,1
rioting,NaN,bloody hell upgraded rioting hyperbole saints,1
rioting,brazil,twitter count rioting financial collapse brazil rio,1
rioting,NaN,black dude antioch rioting,0
rioting,NaN,runjewels recently met bac discuss race relations america amp benefits rioting loveislove,0
rioting,georgia,reuters people like charged inevitable rioting contributing lies,0
rioting,california,cindy noonancindynoonanheartbreak baltimore rioting historical undergroundrailraod,1
rioting,NaN,leeds fan rioting embry lower tier league cup final dee dum,1
rioting,NaN,rioting couple hours left class,1
rioting,bellville,cloydrivers plenty black people rioting toss won championship,0
rioting,america,evasive ferguson riots worked time rioting change fixed,1
rioting,indiana,bbcnews ass british insurers says rioting cost insurers ampmillions police numbers reduced blind fat contr,1
rioting,NaN,bhramabull watch run jewels use facts defend rioting ferguson socially minded duo takes,1
rioting,NaN,think twitter invented insomniacs rioting wee small hours,0
rioting,NaN,blutz people rioting justice served murderer bars simple justice peace justicepeace,1
rioting,NaN,rioting gmail,0
rioting,scotland,jasalhad brianboru jimskiv hijinks rioting,1
rioting,NaN,ryleedowns nevaehburton money tomorrow rioting,0
rioting,sweden,sweden venezuela days rioting venezuela riots directed grab,1
rioting,NaN,davidolszak rioting happy valley penn state loses,0
rioting,NaN,aelinrhee group mascara smeared girls rioting horrific think,1
rioting,wesley verhoek,time high profile signing nffa city rioting wesley verhoek household botanic,1
rioting,NaN,glorious alternatives legal alternatives protesting rioting peaceful thing demonstration,0
rioting,colonial heights,halljh sick criminals parents friends rioting killed police damn officer,1
rioting,NaN,blutz rioting began prior decision indictment making sense point,1
rioting,india,ashes test match currently interesting stupid congress rioting,1
rioting,NaN,people rioting think samisen lto,1
rioting,scotland,football hooligan jailed rioting game scotland banned matches england knew,1
rioting,alabama,cindy noonancindynoonanheartbreak baltimore rioting historical undergroundrailraod,0
rioting,indiana,bbcnews ass british insurers says rioting cost insurersmillions police numbers reduced blind fat controllers,1
rioting,NaN,faafa lived amp family lived countries looters shot sight rioting tolerated,1
rubble,columbus,refuse let life reduced rubble shit keeps piling shovel expired,0
rubble,china,china stock market crash gems rubble chinas stock market crash su forbes,0
rubble,NaN,nuclear arms race going rubble bounce winston churchill,0
rubble,NaN,accionempresa chinas stock market crash summer sparked interest bargain hunt gerenciatodos,1
rubble,NaN,accionempresa chinas stock market crash summer sparked interest bargain hunt gerenciatodos,0
rubble,NaN,parents impulsive remember coming home room filled dust amp rubble wanted redesigned,0
rubble,NaN,turning rubble disasters lego bricks build houses belongs crazyideascollege,0
rubble,ghana,wisenews china stock market crash gems rubble,0
rubble,NaN,forbes china stock market crash gems rubble chinas stock market crash summer ha,0
rubble,dubai,forbes europe china stock market crash gems rubble,1
rubble,NaN,chinas stock market crash summer sparked interest bargain hunters bulls betting rebound,0
rubble,arizona,jasonpope johnfugelsang referring main buildings hit rubble,1
rubble,china,china stock market crash gems rubble,0
rubble,london,wisenews china stock market crash gems rubble,1
rubble,NaN,jun yemeni search survivors rubble houses old city sana following,1
rubble,china,china stock market crash gems rubble forbesasia,1
rubble,st. louis,steve buscemi firefighter fame amp work sehr shifts diggin etc rubble look survivors,1
rubble,china,china stock market crash gems rubble cot pa news,0
rubble,china,china stock market crash gems rubble chinas stock market crash summer forbes,0
rubble,chester,found diamond rubble,0
rubble,china,china stock market crash gems rubble,1
rubble,china,china stock market crash gems rubble tormentor yycwalks,1
rubble,china,china stock market crash gems rubble,0
rubble,detroit,wisenews china stock market crash gems rubble,1
rubble,portland,new post china stock market crash gems rubble,0
rubble,china,china stock market crash gems rubble chinas stock market crash summer sparked,0
rubble,dallas,photo postapocalypticflimflam prodding rubble,0
rubble,NaN,wisenews china stock market crash gems rubble,0
ruin,california,gabby damn suh let ruin year bruh year better start carpooling like day,0
ruin,nashville,ruin mood lost direction,0
ruin,NaN,ruin,0
ruin,NaN,quote let problems ruin faith,0
ruin,london,im anxious pal watching meet makes uncomfortable let ruin moment,0
ruin,texas,smokers ruin new car smell,0
ruin,yulee,chrisdyson wait friends mta ruin sorrybutitstrue,0
ruin,texas,im sad red closing yuppies tourists ruin,0
ruin,NaN,got ruin mood,0
ruin,NaN,understand wanting hang guy friends space ruin trust,0
ruin,NaN,like earth want anybody unhappy purposely ruin somebody elses happiness,0
ruin,NaN,fresh da shower looks loving new hair ruin brand yes,0
ruin,NaN,savannahross tryna ruin life,0
ruin,NaN,applaud terrific ruin,0
ruin,wailuku,things ruin personal injury accident claim,1
ruin,NaN,ruin holidays work zone,0
ruin,lima,time good day ruin,0
ruin,long beach,want ruin relationship ask intentions,0
ruin,belfast,ruin awful minions,0
ruin,NaN,awful work artist ruin things,0
ruin,new york,damn wale knows ruin song,0
ruin,NaN,play like symphony play till fingers bleed im greatest masterpiece ruin,0
ruin,NaN,family ruin actually going good,0
ruin,NaN,hate im awkward ruin things,0
ruin,NaN,long road ruin foo fighters,0
ruin,manitoba,ruin gearbox ruined sour cream brick cheese freezerdummy,0
ruin,NaN,let assholes ruin night,0
ruin,boston,lol real issue way ifl trying ruin guys legacy,0
ruin,florida,ruin connormidd day,0
ruin,sacramento,greedy bastards fullscreen way ruin creativity censorship youtube,0
ruin,NaN,juliechen going ruin game vanessa great player,0
ruin,NaN,conv yes yes want ruin life lol,0
ruin,NaN,nba want reboot fresh prince blair bring original cast amp ruin,0
ruin,NaN,happy fuck tryna ruin smiling,0
