keyword,location,text,target
earthquake,NaN,deeds reason earthquake allah forgive,1
fire,canada,forest fire near la range ask canada,1
evacuation,NaN,residents asked shelter place notified officers evacuation shelter place orders expected,1
evacuation,california, people receive wildfires evacuation orders california,1
smoke,alaska,got sent photo ruby alaska smoke wildfires pours school,1
fire,california,rockyfire update california closed directions lake county fire afire wildfires,1
flooding,manitou colorado,flood disaster heavy rain causes flash flooding streets manitou colorado springs areas,1
fire,NaN,im hill fire woods,1
evacuation,NaN,emergency evacuation happening building street,1
tornado,NaN,im afraid tornado coming area,1
died,NaN,people died heat wave far,1
flooding,NaN,haha south tampa getting flooded hah wait second live south tampa going going fuck flooding,1
flooding,florida,raining flooding florida tampabay tampa days ive lost count,1
flood,myanmar,flood ago myanmar arrived ago,1
crash,NaN,damage school bus multi car crash breaking,1
NaN,NaN,man,0
NaN,NaN,love fruits,0
NaN,NaN,summer lovely,0
NaN,NaN,car fast,0
NaN,NaN,goooooooaaaaaal,0
NaN,NaN,ridiculous,0
NaN,london,london cool,0
NaN,NaN,love skiing,0
NaN,NaN,wonderful day,0
NaN,NaN,ooooooh,0
eat,NaN,wayi eat shit,0
NaN,new york,ny week,0
NaN,NaN,love girlfriend,0
NaN,NaN,cool,0
NaN,NaN,like pasta,0
NaN,NaN,end,0
ablaze,NaN,bbcmtd wholesale markets ablaze,1
ablaze,NaN,try bring heavy metal,0
ablaze,NaN,africanbaze breaking newsnigeria flag set ablaze aba,1
ablaze,philadelphia,crying set ablaze,0
ablaze,london,plus look sky night ablaze,0
ablaze,pretoria,phdsquares muff built hype new acquisitions doubt set el ablaze season,0
ablaze,NaN,ine office asia set ablaze,1
ablaze,santa cruz,barbados bridgetown jamaica cars set ablaze santa cruz head elizabeth police superintend,1
ablaze,NaN,ablaze lord,0
ablaze,NaN,check,0
ablaze,NaN,outside ablaze alive dead inside,0
ablaze,NaN,awesome time visiting cfo head office ancor site ablaze thanks tita vida taking care,0
ablaze,NaN,soooo pumped ablaze southridgelife,0
ablaze,chicago,wanted set chicago ablaze preaching hotel,0
ablaze,NaN,gained followers week know stats grow,0
ablaze,california,west burned thousands wildfires ablaze california,1
ablaze,NaN,building perfect blacklist life leave streets ablaze,0
ablaze,NaN,check,0
ablaze,england,night retainers weird better wear single night year,0
ablaze,sheffield township,deputies man shot brighton home set ablaze,1
ablaze,india,man wife years jail setting ablaze niece,1
ablaze,santa cruz,santa cruz head elizabeth police superintendent sanford salmon,0
ablaze,NaN,police arsonist deliberately set black church north carolinaablaze,1
ablaze,NaN,noches bestia alexissanchez happy teammates training hard goodnight gunners,0
ablaze,turkey,kurds trampling turkey flag later set ablaze vandalized offices turkey dial,1
ablaze,south africa,truck ablaze run voortrekker ave outside mambo cargo section,1
ablaze,sao paulo,set hearts ablaze city gift skyline like kiss lips,0
ablaze,los angeles,sky ablaze tonight los angeles im expecting ig fu filled sunset shots know peeps,0
ablaze,california,west burned thousands wildfires ablaze california climate energy,1
ablaze,NaN,revel wuv videos means mac farewell ablaze wuv en route gtxrwm,0
ablaze,NaN,progressive greetings month students set pens ablaze torch publications,0
ablaze,indiana,rene ablaze amp jacta secret k fallen skies edit mar ,0
ablaze,california,nazista steve fires california tinderbox clown setting hood ablaze news,1
ablaze,calgary,downplaying rene ablaze amp ian buff magnitude ed,0
ablaze,NaN,nxwestmidlands huge fire wholesale markets ablaze,1
ablaze,san francisco,ablaze time talk know work,0
accident,NaN,kids cuz got bicycle accident amp split testicles impossible kids michael father,0
accident,nashville,accident nashvilletraffic traffic moving slower usual,1
accident,santa clara,accident center lane blocked santaclara great america play bagara traffic,1
accident,uk,personalinjury accident summer read advice amp solicitor help otleyhour,0
accident,st. louis,louis caraccidentlawyer speeding causes teen accidents car accident teeth,0
accident,alabama,reported motor vehicle accident curry herman red near stephens involving overturned vehicle use,1
accident,australia,bigrigradio live accident awareness,1
accident,north carolina,mile marker south mooresville resell vehicle accident ramp closed,1
accident,NaN,sleepjunkies sleeping pills double risk car accident,0
accident,NaN,accident knew gon happen,0
accident,san mateo county,traffic accident carrillo hwymagellan av mir ,1
accident,north carolina,mile marker south mooresville resell vehicle accident congestion,1
accident,kenya,pastor scene accidentwho owner range rover,1
accident,NaN,mom home fast wished mom accident truck spilt mayonnaise,0
accident,NaN,horrible car accident past sunday im finally able thank god,1
accident,NaN,wait pissed donnie tell accident,0
accident,arlington,truckcrash overturns notworth interstate click crash,1
accident,ohio,accident nashville traffic,1
accident,NaN,carolina accident motorcyclist dies crash car crossed median motorcycle rider traveling,1
accident,new hanover county,fyi caddy accident property damagenhs pine rdhorndale,1
accident,NaN,navy accident years turning chandanee mag near mma taxi rammed halfway turned confer,1
accident,manchester,accident left lane blocked manchester eddy red stop traffic nha delay mins traffic,1
accident,wilmington,accident property damage pine rdhorndale,1
accident,NaN,accident,0
accident,new hanover county,fyi caddy accident property damagewpd,1
accident,NaN, traffic accident injury willis foreman red,1
accident,NaN,aashiqui actress anu aggarwal nearfatal accident,1
accident,alberta,outfield alberta accident,1
accident,NaN, mile backup southaccident blocking right lanes exit planetree reconsider alternate,1
accident,baton rouge,accident changed life help determine options financially support life care plans ongoing treatment,0
accident,maryland,breaking deadly motorcycle car accident happened hagerstown today details yourstate,1
accident,gloucestershire,floor marinating accident,0
accident,NaN,car week got fucking car accident ifs fucking drive,1
accident,uk,norwaymfa bahrain police previously died road accident killed explosion,1
accident,measuresarrestpastornganga,heard church leaders kenya coming forward comment accident issue disciplinary measuresarrestpastornganga,0
aftershock,NaN,aftershockdelo scum live game cya,0
aftershock,West Virginia,man drive effort gets painful man win roger bannister,0
aftershock,switzerland, ir iceman aftershock djicemoon dubstep trapmusic dna ed dance ices,0
aftershock,West Virginia,victory bargain basement prices dwight david eisenhower,0
aftershock,us, ir iceman aftershock djicemoon dubstep trapmusic dna ed dance ices,0
aftershock,West Virginia,remembers came second charles schultz,0
aftershock,NaN,aftershockdelo im speaking scum people end getting,0
aftershock,West Virginia,harder conflict glorious triumph thomas paine,0
aftershock,NaN,growingupspoiled going clay pigeon shooting crying aftershock,0
aftershock,NaN,guess actually wants free aftershock,0
aftershock,NaN,aftershock terrifying best roller coaster ive disclaimer ive,0
aftershock,belgium,aftershock,0
aftershock,switzerland, ir iceman aftershock djicemoon dubstep trapmusic dna ed dance ices,0
aftershock,us, ir iceman aftershock djicemoon dubstep trapmusic dna ed dance ices,0
aftershock,NaN, ir iceman aftershock djicemoon dubstep trapmusic dna ed dance ices,0
aftershock,NaN,kjfordays im seeing issues aftershock,0
aftershock,switzerland, ir iceman aftershock djicemoon dubstep trapmusic dna ed dance ices,0
aftershock,switzerland, ir iceman aftershock djicemoon dubstep trapmusic dna ed dance ices,0
aftershock,oshawa,widowed bonus minute daily habits improve life lifehacks,0
aftershock,oregon,aftershock protect profit global financial meltdown david wieder help,0
aftershock,NaN,moment scary roller coaster guy screaming bloody murder silverwork aftershock,0
aftershock,NaN,aftershock streaming youtube,0
aftershock,united states,aftershock protect profit global financial book esquireattire,0
aftershock,West Virginia,face difficulties wrong right joel steen,0
aftershock,West Virginia,thing stands dream try belief actually possible joel brown,0
aftershock,california,praise god ministry tells like youth biblestudy,0
aftershock,West Virginia,remembering going die best way know avoid trap thinking lose steve jobs,0
aftershock,hermosa beach,tried orange aftershock today life,0
aftershock,NaN,onfireanders love,0
aftershock,NaN,aftershock,0
aftershock,NaN,aftershock school kick great want thank making possible great night,0
aftershock,West Virginia,people interrupt george bernard shaw,0
aftershock,West Virginia,man gets oyster second man gets andrew carnegie,0
aftershock,NaN,need tonight play hybrid slayer psi eu hum codsandscrims empirikgaming codawscrims tpkotc tpa aftershockorg,0
airplane accident,france,experts france begin examining airplane debris found reunion island french air accident experts o news,1
airplane accident,pennsylvania,strict liability context airplane accident pilot error common component aviation,1
airplane accident,utah,crobscarla lifetime odds dying airplane accident ,0
airplane accident,france,experts france begin examining airplane debris found reunion island french air accident experts wed,1
airplane accident,NaN,alexalltimelow aww airplane accident going die cuties good job,1
airplane accident,spain,family members osama bin laden died airplane accident ironic mommy gov shit suspect,1
airplane accident,jaipur,man goes airplane engine accident youtube,1
airplane accident,NaN,horrible accident man died wings airplane ,1
airplane accident,mexico,cessna airplane accident campo coahuila mexico july killed men including state coahuila government official,1
airplane accident,NaN,horrible accident man died wings airplane watchthevideo,1
airplane accident,france,experts france begin examining airplane debris found reunion island french air accident experts wednesdays,1
airplane accident,france,experts france begin examining airplane debris found reunion island french air accident experts wednesday began examining,1
airplane accident,indonesia,votejktid mbataweel rip unladen family members killed airplanes accident,1
airplane accident,NaN,sent coworker nudes accident thank god airplane mode,0
airplane accident,new mexico,mickinyman theatlantic killed airplane accident night car wreck politics best,0
airplane accident,france,experts france begin examining airplane debris found reunion island french air accident experts mob,1
airplane accident,NaN,unbelievably insane man airport airplane aircraft aeroplane runway accident freaky,1
airplane accident,mumbai,horrible accident man died wings airplane,1
airplane accident,NaN,horrible accident man died wings airplane ,1
airplane accident,u.s,osama bin ladies family dead airplane crash naturally accident,1
airplane accident,NaN,pilot dies plane crash car festival youtube crash aircraft airplane pilot death accident arrest,1
airplane accident,pennsylvania,strict liability context airplane accident,1
airplane accident,france,don brazil experts france begin examining airplane debris found reunion island french air accident exp,1
airplane accident,france,experts france begin examining airplane debris found reunion island french air accident experts wed,1
airplane accident,NaN,horrible accident man died wings airplane wif cant believe eyes,1
airplane accident,NaN,nicole fletcher victim crashed airplane times ago accident left little bit trauma,1
airplane accident,india,omg horrible accident man died wings airplane,1
airplane accident,NaN,omg believe rip bro airplane accident jetengine turbojet boing,1
airplane accident,france,experts france begin examining airplane debris found reunion island french air accident experts wednesday began examining,1
airplane accident,israel,airplane accident,1
airplane accident,NaN,phone looks like car ship airplane accident terrible,0
airplane accident,san francisco,statistically im risk getting killed cop dying airplane accident,0
airplane accident,colombia,airplane crashes house colombia people die accident,1
airplane accident,NaN,shooting airplane accident,1
airplane accident,toronto,drone airplane accident pilots worried use drones esp close vicinity airports,1
ambulance,NaN,early wake sister begging come amp ride wher ambulance hospital rodian,1
ambulance,NaN,feared killed pakistani air ambulance helicopter crash,1
ambulance,NaN,air ambulances scene crash cars lorry emsne,1
ambulance,NaN,feared killed pakistani air ambulance helicopter crash reuters yovani,1
ambulance,la,leading emergency services boss welcomes new ambulance charity,0
ambulance,west wales,travelling aberystwythshrewsbury right incident services halt outside shrews ambulance scene,1
ambulance,NaN,feared killed pakistani air ambulance helicopter crash,1
ambulance,NaN,ambulance sprinter automatic frontline vehicle choice lez compliant ebay,0
ambulance,cambridge,new nanotech device able target destroy blood clots,0
ambulance,arizona,skyhawkmm traplord fredosantana lilreese hella crazy fights ambulance couple mosh pits,1
ambulance,mumbai,run ambulance lucky justifying randomthought,0
ambulance,NaN,news feared killed pakistani air ambulance helicopter crash pillow dna,1
ambulance,NaN,feared killed pakistani air ambulance helicopter crash,1
ambulance,england,tanslash waiting ambulance,0
ambulance,oklahoma,fouseytube ok need ambulance hahaha good,0
ambulance,NaN,ambulance sprinter automatic frontline vehicle choice lez compliant ebay,0
ambulance,NaN,pakistan air ambulance helicopter crash kills,1
ambulance,oklahoma,thenissonian rejectdcartoons nissan ok need medical assistance ambulance need,0
ambulance,new york,ems ny emts petition hour minimum wage ems paramedics ambulance,0
ambulance,NaN,feared killed pakistani air ambulance helicopter crash,1
ambulance,NaN,feared killed pakistani air ambulance helicopter crash,1
ambulance,NaN,ambulance sprinter automatic frontline vehicle choice lez compliant ebay,0
ambulance,NaN,ambulance sprinter automatic frontline vehicle choice lez compliant ebay,0
ambulance,colorado,kiwikaryn check parking lot said year ambulance johns,0
ambulance,NaN,know way ambulance coming lilt,1
ambulance,NaN,reuters feared killed pakistani air ambulance helicopter crash,1
ambulance,NaN,feared killed pakistani air ambulance helicopter crash,1
ambulance,NaN,ambulance right outside work,0
ambulance,canada,leoblakecarter dog thinks ambulance,0
ambulance,NaN,happening hatzolah ems ambulance responding dual sirens,0
ambulance,lexington,feared killed pakistani air ambulance helicopter crash,1
ambulance,NaN,feared killed pakistani air ambulance helicopter crash,1
ambulance,NaN,feared killed pakistani air ambulance helicopter crash worldnews,1
ambulance,hannover,feared killed pakistani air ambulance helicopter crash worldnews,1
ambulance,NaN,police ambulance number desoto body know,0
ambulance,NaN,medic aaceorg surprised standardised clinical practice nos ambulance trust,0
ambulance,NaN,feared killed pakistani air ambulance helicopter crash,1
ambulance,davidson,people try walk ambulance passing hate,0
annihilated,NaN,episode trunks annihilated freeze cleanest shit showed nigga mercy,0
annihilated,michigan,shall annihilated petebests dedicated laid bare shall kneel,0
annihilated,new york,tribe annihilated baseball mets,0
annihilated,boksburg,marksmaponyane heysundowns annihilated previous meeting celticindeed improvement,0
annihilated,florida,volfan snazzy mizzen annihilated florida past seasons ended muschamps career compete bama,0
annihilated,NaN,annihilated abs,1
annihilated,NaN,annihilated status education mba behalf easy street careen dovm,0
annihilated,au,luka die annihilated lois tracy,0
annihilated,uk,acarewornheart good un fella sorry annihilated,0
annihilated,boston,cop pulls drunk driver safety seconds car hit train viralspell,1
annihilated,NaN,annihilated,0
annihilated,NaN,cop pulls drunk driver safety seconds car hit train viralspell,1
annihilated,britain,boom country entirely annihilated britain,0
annihilated,NaN,amirkingkhan annihilated thank floydmayweather,0
annihilated,israel,thing surgeon promised israel annihilated butthe horror iran nukes,0
annihilated,oklahoma,violentfeminazi guess ok armenians spent history getting annihilated,1
annihilated,NaN, years annihilated people instantly aware ability annihilate humanity,1
annihilated,NaN,day tryouts went good minus fact stopped quickly short ball annihilated toenail injury,0
annihilated,london,s oryx symbol arabian peninsula annihilated hunters,1
annihilated,NaN,luka die annihilated lois tracy,0
annihilated,NaN,ready annihilated bus game,1
annihilated,NaN,philipduncan breakfasting people annihilated nights weather philip thought forecast,1
annihilated,NaN,domain sophistication annihilated closely uptotheminute feat zone,0
annihilated,uk,storyboard steelwork seen judas priest rob came scorpions support fucking annihilated place astonishing gig,0
annihilated,pennsylvania,officially skipping fantasticfourfantsticwhatever hashtag getting annihilated reviews bummer,0
annihilated,NaN,tomcatarts explaining annihilated case survivor evolved godlike,1
annihilated,NaN,completely annihilated tech paul keegan time alive,0
annihilated,NaN,tomcatarts annihilated legion survivors imperfect hybrid project quickly formed new secret cell,0
annihilated,NaN,sirbrandonknt exactly lesnarcena match summerslam year great brock annihilated guy,0
annihilated,NaN,cop pulls drunk driver safety seconds car hit train viralspell,1
annihilated,NaN,annihilated damascus syrian army grinds alloosh gang manure pile,1
annihilated,oklahoma,that's ok completely forthright food coma kebabtahinipickles annihilated fries,0
annihilated,london,fun filled happyhour simmons bar camden handsome got annihilated apart game,0
annihilated,albany,funny bristol annihilated ball lam,0
annihilation,california,rvfriedmann hell fraction belief total annihilation destruction usa lodisilverado ritzyjewels,1
annihilation,israel,potus maybe israel tell sorry pres sold river annihilation,0
annihilation,NaN,evildead annihilation civilization,0
annihilation,NaN,yous national park services tonto national forest stop annihilation salt river wild horse change,0
annihilation,NaN,annihilating quarterstaff annihilation,1
annihilation,louisiana,world annihilation self transformation aliens attack exterminate humans,0
annihilation,spain,stardate stardate planetary annihilation youtube,1
annihilation,NaN,yous national park services tonto national forest stop annihilation salt river wild horse change,0
annihilation,california,yous national park services tonto national forest stop annihilation salt river wild horse change,1
annihilation,arizona,kimkardashian sign share petition save wild horses arizona,0
annihilation,NaN,yous national park services tonto national forest stop annihilation salt river wild horse change,1
annihilation,california,theellenshow check salt river horses help stop annihilation happen signatureschange org,0
annihilation,united states,souls punished withannihilation,0
annihilation,israel,calfreedommom steph mention major contributor annihilation israel,1
annihilation,NaN,willienelson need help horses displease amp sign petitiontake stand amp voice gilbert,1
annihilation,rock hill,reject laws misguided false prophets imprison nations fueling self annihilation,0
annihilation,arizona,yous national park services tonto national forest stop annihilation salt river wild horse change,0
annihilation,NaN,annihilation jeb christie amp basic hours away god allow day,0
annihilation,NaN,barbitwins need helphorses die amp sign petition stand amp voice gilbert,0
annihilation,NaN,whipped need help horses displease amp sign petitiontake stand amp voice gilbert,0
annihilation,arizona,hey az sign petition save wildhorses tantonationalforest rollingstone signaling order,0
annihilation,ljubljana,stop annihilation salt river wild horses change,1
annihilation,connecticut,sonofbaldwin current nova bookslast checked tied books rider died annihilation,0
annihilation,tacoma,yous national park services tonto national forest stop annihilation salt river wild horse change,0
annihilation,NaN,sign amp save saltriverwildhorses,0
annihilation,NaN,thanks count dante join following annihilation zone johnny,0
annihilation,louisiana,world annihilation self transformation aliens attack exterminate humans,1
annihilation,NaN,yous national park services tonto national forest stop annihilation salt river wild horse change,0
annihilation,arizona,yous national park services tonto national forest stop annihilation salt river wild horse change,1
apocalypse,NaN,im going fight taylor soon,0
apocalypse,ohio,oh fukurodani survive apocalypse bout feels horrible poor boy poor child,1
apocalypse,NaN,jocelyn birthday apocalypse,0
apocalypse,NaN,janenelson stephenscifi adaptation watch charlie humans apocalypse optioned film sciencefiction,0
apocalypse,texas,apocalypse,0
apocalypse,ca,hour august pm heres red rover zombie apocalypse internetradio collegeradi,1
apocalypse,texas,honeybunzgem primalkitchen feel like pull stages apocalypse,0
apocalypse,NaN,kinda hot played radio today disease apocalypse started careful,0
apocalypse,NaN,apocalypse lol,0
apocalypse,texas,know question interpretation sign apocalypse called,1
apocalypse,oakland,julie apocalypse version romeo juliet hardbodies,0
apocalypse,NaN,apocalypse,0
apocalypse,NaN,fittscott minecraft night lucky block mod bob apocalypse wither amp mod showcase popularmmos view,0
apocalypse,NaN,begins day snow apocalypse,1
apocalypse,NaN,ourmothermary short reading apocalypse spirit angel took enormous high mountain,0
apocalypse,argentina,candlelit imagine serum zombie apocalypse fighting heart heart conversations,0
apocalypse,NaN,zonewolf liked youtube video minecraft night lucky block mod bob apocalypse wither amp,0
apocalypse,NaN,planet lone audience apocalypse,0
apocalypse,san antonio-ish,dad bought looks like science doc read actually impending biblical apocalypse,1
apocalypse,san francisco,alexandrapullin apocalypse comes week know,0
apocalypse,oregon,look grizzly peak right looks like beginning dystopian apocalypse movie,0
apocalypse,texas,niece asked scared apocalypse,0
apocalypse,cairo,storm cairo latest men apocalypse set photo cahoots,1
apocalypse,NaN,minecraft night lucky block mod bob apocalypse wither amp mod showcase popularmmos youtube,0
apocalypse,NaN,shot heart xu going totally love bad heart pierce,0
apocalypse,NaN,geekapocalypse jesse plays dark souls day etc,0
apocalypse,las vegas,know zombies,0
apocalypse,NaN,latest bryansinger reveals storm queen apocalypse rural alexshipppp,1
apocalypse,NaN,shadow boxing apocalypse,1
apocalypse,NaN,short reading apocalypse spirit angel took enormous high mountain,1
apocalypse,tokyo,enjoyed liveaction attack titan time posters im reminded freshly clean coiffed apocalypse,0
apocalypse,NaN,liked youtube video minecraft night lucky block mod bob apocalypse wither amp mod showcase,0
armageddon,california,plan temporary abyss armageddon kill flags fast reason,0
armageddon,california,plan temporary russaky armageddon kill flags fast reason,0
armageddon,uk,official vid doublecups trudge prod thisizbwright armageddon,0
armageddon,NaN,oviedo peace love amp armageddon,0
armageddon,NaN,best movie seen armageddon,0
armageddon,holland,bed time wake revolution armageddon start,0
armageddon,xbox,red faction armageddon microsoft xbox read ebay,0
armageddon,NaN,katiekatcubs know shit goes world series armageddon,0
armageddon,NaN,ophiuchus love truelove romance lith voodoo seduction astrology start lot apocalypse armageddon pla,0
armageddon,NaN,im going beat armageddon su hao got flawless try,0
armageddon,canada,news ben affleck know wifekids girls help ive loved armageddon eonlinechat,0
armageddon,worn certainty,long coat hand worn certainty armageddon bears sense occasion,0
armageddon,NaN,phone spying hidden door nsa data mining software financial armageddon blog,0
armageddon,california,plan temporary hyiderghost armageddon kill flags fast reason,1
armageddon,NaN,rtrrtcoach love truelove romance lith voodoo seduction astrology start lot apocalypse armageddon planet,0
armageddon,california,plan temporary fighterdena armageddon kill flags fast reason,0
armageddon,new york city,photo sketch based taste armageddon episode started tos,0
armageddon,NaN,armageddon,1
armageddon,NaN,aberdeen aberdeenfanpage good luck tomorrow night coefficient points ply armageddon,0
armageddon,NaN,paddytomlinson armageddon,0
armageddon,NaN,rohnertparkdps history books thank justice department way paid income tax yrs,0
armageddon,florida,vladimir putin issues major warning late escape armageddon,1
armageddon,NaN,gods kingdom heavenly govt rule people earth armageddon,0
armageddon,NaN,entertainment lot brucewillis movies die hard monkeys armageddon sixth ebay auction,0
armageddon,NaN,lets talk goof guild saunders come right stage,0
armageddon,NaN,karnythia niece gaining ability stand im getting prepared toddler apocalypse armageddon,0
armageddon,california,check preppers doomsday library collection ad shto preppertalk survival prepper ebay,0
armageddon,toronto,ecker eep thought yesterday saw hella scary hail armageddon,1
armageddon,NaN,ahmed's think messiah come years ago armageddon kajal gog amp magog,0
armageddon,NaN,sadly windows reveals microsoft ethics armageddon,0
