keyword,location,text,target
damage,NaN,hfxstanfield believed discoverycntr happening hear runway lighting damage contractor,1
damage,NaN,swb nda written damage ability offer services future prolly want work,0
damage,NaN,trillion crosses line ord time fieldwide attack instant kill damage,1
damage,NaN,metallica damage inc,0
damage,calgary,inmates charged causing damage calgary remand centre riot,1
damage,new york,crosssectarian protest powerful shia cleric says militias withdraw fightin isis forget damage use ur pal,1
damage,NaN,homeowners insurance cover water damage good things know,1
damage,NaN,beach damage shit,1
damage,NaN,wonderousallure crosses arms cover hands anymore damage hello,0
damage,toronto,new post blog thesensualeye model cam damage toronto apr pussy ass boobs asian nude,0
damage,statesville,reported hit amp ruin roadwayproperty damage statesville red,1
damage,NaN,devil cry special edition virgil agnes window mission damage leedstraif,0
damage,rockville,glaucoma occurs fluid builds pressure inside eye level damage optic nerve eyefacts,1
damage,jsunnews,jsunnews storm damage reported madison county thunderstorm damage reports ar,1
damage,NaN,sa puncture wound foreign body left index finger damage nail initial encounter icd,1
damage,australia,thank richarkkirkarch ausinstarchitect words warning queenswharf brisbane financialreview,0
damage,NaN,real shit damage bitch,0
damage,NaN,lao fuckyou changed damage control pseudojuuzo,0
damage,india,michaelwestbiz standard damage control,1
damage,tennessee,gettinglost jennellensbb munclejim said superficial wounds pepper spray damage,1
danger,NaN,blizzheroes dustinbrowder dad chase constantly amp time frequently great deal danger distraction lto,0
danger,NaN,believe shirt company animal danger better start seeing changes wildlife,0
danger,NaN,danger union bears,0
danger,NaN,signup open falling danger release day blast review tour signup,1
danger,NaN,dyannbridges yeshayad check rockin preview claytonbryant danger zone coming soon artistsunited,0
danger,california,red flag warning fire danger amp dry thunderstorms bay area weather caws nwsbayarea,1
danger,NaN,carsonrex spaceangelseven check rockin preview claytonbryant danger zone coming soon artistsunited,0
danger,loughborough,like danger,1
danger,NaN,tree cut fish eaten stream poisoned realize,0
danger,brooklyn,away preservation parks imposition amp danger african people imagined,0
danger,NaN,indian govt amp media concern safety danger,1
danger,minnesota,training grains wheat bare gold august heat anger im trespass lest seek danger,0
danger,therealrittz,therealrittz fettilootch slanglucci oppressions greatest danger coming soon album,0
danger,NaN,morehouse appears govt lost ethical moral relevance means usa population danger,0
danger,illinois,like head slides especially home danger,0
danger,florida,permits bear hunting danger outnumbering actual bears licenses florida fir petersburg,0
danger,NaN,riverroaming danger,0
danger,atlanta,bluebirddenver fettilootch slanglucci oppressions greatest danger coming soon album,1
danger,boston,uber looking repair recent bad rap nonprofit partnerships,0
danger,NaN,wish victorian secret im good,0
danger,NaN,turnedonfetaboo hsjb check rockin preview claytonbryant danger zone coming soon artistsunited,0
danger,west ham,theta gunnersfan arsenal fans want west ham delegation battle season danger afc sun,0
danger,atlanta,remainontop fettilootch slanglucci oppressions greatest danger coming soon album,0
danger,atlanta,nuggets fettilootch slanglucci oppressions greatest danger coming soon album,0
danger,NaN,danger excitement underwater cave diving,0
danger,NaN,girl want save like danger health try somebody want somebody,0
danger,NaN,guns protection shit life danger,0
danger,NaN,thirsty danger dehydration,1
danger,san jose,thunderstorms little rain expected central california high fire danger weather caws,1
danger,NaN,want danger days tattoo bad cool spider look like someones wrist smith,0
danger,israel,experience angry critical pundit grave danger going rails ,0
danger,NaN,danger skyler danger,0
danger,oklahoma,dangerous ok rest danger,0
danger,silver spring,investigate robert mueller respond complaints nov amp left meson danger,0
danger,NaN,honestly tho modify manga stealing living fuck im past best danger fucktard coy,1
danger,NaN,fear way making danger contemplating logic situation find courage engage,0
dead,NaN,joel book acts ,0
dead,afghanistan, dead afghanistan aircraft crashes afghan military helicopter crashed remote region,1
dead,sweden,silentsiris awesome norse landscapes loads atmosphere life boringdead snotgreen wastelands,0
dead,NaN,miss longer haircut dead anyways hair,0
dead,NaN,banning sake presuppose reborn attained individual rightsgenerally court law forbids killing dead person,0
dead,london,remember time goku gave life dead bird hell goku,0
dead,nana,nana bee dead like legit zombie feel sore body,0
dead,NaN,happened road right buses im dead,0
dead,NaN,lao fucking luis hahaha im dead,0
dead,NaN,watched emmerdale know slightly attractive man named ross got beat dead,1
dead,ohio,soapscoop need confirm ross dead trust oh,0
dead,NaN,gailsimone iwasdisappointedby telltale walking dead good characters amatory real gameplay performance issues,0
dead,NaN,beforeitsnews hundreds feared dead libyan migrant boat capsizes rescue,1
dead,portugal,war came waved white flag cant end dead misled,0
dead,ohio,joneskyle oh fuck sake dead,0
dead,dundalk,emmerdale ross dead askcharley,0
dead,NaN,don avoid wearing dead black flaming red stark white esp debate blue gold brown shoes,0
dead,NaN,perspectives grateful dead critical writings contributions study,1
dead,NaN,portal hello im looking mod cold ice saw site link download dead maybe share thanks,0
dead,new york,kgvaal lmaovv hard ny new trend babalmaowelcome nazi kwaaaaadead,0
dead,NaN,joneskyle ive said dead dies,0
dead,NaN,ross dead noooooooooooo mikeparractor,0
dead,kettering,thinking time friend bailed nite dead showmen amp great time free dance row,0
dead,taiwan,typhoon soudelor taking dead aim taiwan,1
dead,NaN,askcharley emmerdale emotional ross dead emmerdale ,0
dead,NaN,man found dead demi moores swimming pool,1
dead,NaN,val dead im suing,1
dead,NaN,atchisonsean dead,0
dead,united states,wormwood road dead fucking awesome awesome ending awesome,0
dead,NaN,believe ross dead emmerdale mikeparractor emmerdale summerfate,0
death,NaN,text niggas amp boyfriend love boys death niggas hold attention like,0
death,NaN,hate talking grandma mean love death talk damn ssshhheeesshh,0
death,NaN,death forever rep jets,1
death,NaN,vibrator shaped vape busted,0
death,NaN,death threats nigga life gon,0
death,michigan,adult dies plague colorado,1
death,new york,xbox pro console red ring death read ebay,0
death,argentina,going gainesville death,1
death,NaN,year later ferguson sees change asks real,0
death,NaN,papiichampoo enjoy obama era civility prez says gop supports iranian wouldest,0
death,NaN,feel like death,0
death,uk,liked youtube video jeromekem hazard death sport,0
death,NaN,tell cousins want hang text saying coming honestly death wish,0
death,texas,ass judge orders texas recognize spouse siamese death certificate,0
death,NaN,loyalty mission involves kicking shitty nobleman death love elven weirdo,0
death,kensington,way seemeth right unto man end thereof ways death,1
death,buffalo,kellkane thanks narrowly averted death fun right,1
death,NaN,arianagrande screamqueens katherine death,0
death,sylacauga,allahsfinest death muslims,1
death,NaN,going starve death,0
death,NaN,ted cruz bashes obama comparison gop iranians shouting wouldest america,0
death,NaN,arianagrande screamqueens katherine death,0
death,NaN,new crime knowing rights punishable death,0
death,NaN,issues uploading death smoochy awakenings clips youtube reason bicentennial man pain ass,0
death,NaN,ted cruz bashes obama comparison gop iranians shouting wouldest america cot,1
death,NaN,cyprus news analysis mullah mars death split talibans ranks mars demise certainly lead,1
death,kansas,feel like deathly moles,0
death,ca,video slain mexican journalist unknowingly predicted death breitbartnews,0
death,portland,old lady rockin death metal sedan downtown smoking cigarette found real mom,0
death,NaN,afghan peace talks doubt mullah mars death financial times mullah,0
death,NaN,pusssssssssy shook death,0
death,new york,trial death cecilthelion postponed,0
death,NaN, years ago week anniversary marilyn monroe death ripriprip,0
death,NaN,aris hints snippets death,0
death,chicago,tomorrow death,0
death,new york,new ny legionnaires disease death toll rises follow,1
deaths,NaN,vaxshill deaths measles complications yrs looses shit dead legionnaires month amp crickets,1
deaths,NaN,bigamist wife charged deaths second pregnant wife child mother nephew,0
deaths,mooresville,south huge wreck airlift maybe deaths interstate completely blocked,1
deaths,maine,lolgop cases voter fraud year need new laws gun deaths day actually follows laws airite vra,1
deaths,NaN,silence palermo shipwreck children deaths,1
deaths,NaN,bef japans died fedayeen aks bloody incas incas rifles blame soldiers deaths mod,1
deaths,NaN,breast milk original superfood rates worldwide stalled contributing child deaths year,0
deaths,new jersey, deaths relight running crashes pedestrians bicyclists amp vehicle occupants hit relight runners,1
deaths,NaN,truediagnosis k deaths year physician error avoid,1
deaths,NaN,cdcwhistleblower deaths measles complications yrs looses shit dead legionnaires month amp crickets,1
deaths,NaN,bigamist wife charged deaths second pregnant wife child news,0
deaths,tarletonsophie, deaths year foodborne illness frackfreelancs dears deccgovuk frackfreeeu tarletonsophie,1
deaths,atlanta,hear drfriedencdc talk avoid thousands resistant infectionsdeaths yrs adiossuperbacterias,0
deaths,NaN,irony died thousand deaths,0
deaths,NaN,strickskin nickscomics lol usually im objective maybe uncle ben course deaths end business usual,0
deaths,NaN,comment deaths older children data tell nghlth,1
deaths,NaN,deaths ,1
deaths,NaN,jazzy know happened govt think beliefs warranted deaths innocent japs,1
deaths,ohio,real magic real life women went missing ohio town focus fbi probe strange deaths,1
deaths,phoenix,cases constitute epidemic plague health publichealth,1
deaths,NaN,deaths ,0
deaths,NaN,lunch stewart amp julian couple hours earlier good finally find happened,0
deaths,NaN,hepburn police warn public fentanyl deaths province,1
deaths,NaN,annoying crusty lives matter head ass people actually support causes hate black deaths attention,0
deaths,NaN,time reduce gun deaths,1
deaths,NaN,gregorysanders shot amp stat high auto deaths applies children vehicle guess run hightail better adult,0
deaths,NaN,cancers equate deaths blackpool knowing signs save life beclearoncancer,1
deaths,u.s.a,highqualitybird reverse situation lol know civilian deaths specifically utilized political,1
deaths,london,heard deaths murder chrissie kills adam val finn die emmerdale,0
deaths,tennessee,mathewisangry zkesk saladinahmed died horrible deaths trapped ships knew risk,1
deaths,amman,fo minister tobiasellwood condemns attack mosque saudi arabia resulted deaths,1
deaths,NaN,cancers equate deaths blackpool knowing signs save life beclearoncancer,1
deaths,colorado,critters climate plague deaths colorado,1
deaths,NaN,year angela sanders born roundhouse kick related deaths increased percent,1
deaths,columbia heights,walmart taking steps children safe hot vehicles look innovative car seat,0
deaths,NaN,beluga deaths reported seaworld average age years seaworld,1
deaths,NaN,bigamist wife charged deaths second pregnant wife child mothe,1
deaths,NaN,mayoroflondon plus reduce cyclist deaths compulsory highway code test vehicle uses road notrocketscience,1
debris,belbroughton,aerospace exec plane debris missing mh aircraft wing found reunion island,1
debris,NaN,malaysia airlines flight disappeared months ago debris found south indian ocean,1
debris,malaysia,mh aircraft debris found la reunion missing malaysia airlines,1
debris,malaysia,discovered plane debris missing malaysia airlines flight time,1
debris,NaN,confirmed debris mh,1
debris,malaysia,mh aircraft debris found la reunion missing malaysia airlines,1
debris,malaysia,malaysia confirms plane debris washed reunion island flight mh,1
debris,malaysia,mh aircraft debris found la reunion missing malaysia airlines,1
debris,new york,missing jets debris floated reunion new york times,1
debris,new york,reunion debris surely flight officials new york times,1
debris,new york,reunion debris surely flight officials new york times,1
debris,indiana,debris found reunion island flight mh mystery plane disappearance better novel,1
debris,malaysia,mh aircraft debris found la reunion missing malaysia airlines,1
debris,NaN,reuters debris confirmed mh relatives hope discovery crash site,1
debris,NaN,nbcnightlynews malaysian officials debris found reunion island mh billneelynbc reports,1
debris,NaN,mh debris found reunion island sad tragedy innocent crash mh,1
debris,seattle,love food fun malaysian prime minister naib raza confirmed aircraft debris found reunion isla,1
debris,malaysia,malaysia certain france plane debris missing mh,1
debris,new york,malaysian officials debris found reunion island mh billneelynbc reports,1
debris,malaysia,mh aircraft debris found la reunion missing malaysia airlines,1
debris,NaN,debris found reunion island comes mh malaysian,1
debris,malaysia,aircraft debris found island mh malaysia confirms,1
debris,dubai,irony debris flight mh found reunion island,1
debris,malaysia,mh aircraft debris found la reunion missing malaysia airlines abc online,1
debris,malaysia,mh reunion debris missing malaysia flight,1
debris,berlin,experts leave lab malaysia confirms debris mh,1
debris,malaysia,malaysia confirms plane debris washed reunion island flight mh,1
debris,NaN,kamindoz reuters debris confirmed mh relatives hope discovery crash,1
debris,NaN,plane debris discovered reunion island belongs flight mh malaysian,1
debris,tampa,debris confirmed mh relatives hope discovery crash site malaysian officials confirm breath,1
debris,malaysia,abc onlinemh aircraft debris found la reunion missing malaysia airlines abc online piece aircraft debris,1
debris,malaysia,malaysia confirms reunion island debris mh scmpnews,1
debris,NaN,debris confirmed mh relatives hope discovery crash site reuters video,1
debris,hong kong,plane debris missing mh,1
debris,malaysia,mh aircraft debris found la reunion missing malaysia airlines abc online malaysia news,1
debris,malaysia,interesting mh aircraft debris found la reunion missing malaysia airlines abc,1
debris,labuan,aircraft debris confirmed mh nation star online,1
deluge,united kingdom,dustpiggies ah awash abstract dusting tweets explains deluge,0
deluge,NaN,xena bet mother nature plans send deluge way,0
deluge,connecticut,joshsternberg feed deluge twice week fantastic,0
deluge,NaN,romeocrow welcome organizing twitter find important stuff deluge bow loving music signed ep,0
deluge,NaN,niagara falls package deals deluge tours eyes,0
deluge,london,apologise sincerely inevitable deluge gobo tweets come hold grudges decide unfollow baking cakes,0
deluge,los angeles,nlmdimrc deluge resources floods medical providers cleanup workers amp,1
deluge,NaN,rowboat trek sympathy deluge falls vic,1
deluge,NaN,deluge eulogies cecilthelion whatsapp getthis tormented soul matias xavier,0
deluge,washington,wa smiles july deluge west australian yahoos,0
deluge,china,china delaying deluge fundamentals economy support valuations stock,0
deluge,NaN,despite deluge fantasticfour notices man ocean buying tickets bloodyminded like,0
deluge,NaN,photo forrestmankins colorado camping,0
deluge,brackley beach,deluge troisrivieres hour legionstrackandfield,0
deluge,london,halfnaked men twitter tonight normally embrace odd torso scale tonights deluge unprecedented,0
deluge,New York,theburnageblue yes man having bad week far events deluge fans turned right,0
deluge,nottingham,best windows torrent client recommended deluge looks like written years ago java swing uses worse,0
deluge,NaN,fifth predynastic king legendary period deluge dumuzid shepherd,0
deluge,NaN,theghostparty amsosorry deluge hell vines,0
deluge,NaN,strange caustic geography portion till voice deluge bitof,0
deluge,NaN,beach deluge surf camp motion surf therapy programme kicked today,1
deluge,wellington,stephaniemarija light rain forecast based dressing light rain incessant deluge,0
deluge,london,historic applied deluge recently exposed childsexabuse truly historic scale coverup,1
deluge,NaN,bible backs truck unloads descriptive deluge indecency chuckswindoll explains iflcanada,0
deluge,NaN,audio business owners share differently pta,0
deluge,NaN,slew updated posts coming hosting fixed deluge,0
deluge,NaN,photo boyars heaven sent jake warm morning montanas madison river early evening,0
deluge,NaN,camping things gishwhes got soaked deluge going pads tampons mishacollins,0
deluge,NaN,fiendnikki wouldeluge awesome word idea like,0
deluge,NaN,wrinkled face deluge decayed,0
deluge,NaN,schelbertgeorg thanks im teaching online class amp asking students lots questions like sorry deluge ren art,0
deluge,atlanta,showman save big easy deluge supernatural monstrosities read free,0
deluge,NaN,houghjeff crap content marketing deluge dougkessler bob bbagency rideshare contentmarketing,0
deluge,NaN,love song healing heredeluge implanted sing church spanish translated,0
deluge,fort fizz,vince mcmahon billionaire remember reading deluge posts vince mcmahon losing,0
deluge,new york,ifl playing deflategate perfectly deluge incremental stories bored world caring wanting away,0
deluge,fort lauderdale,search powerful content improve business frustrated deluge quantity,1
deluge,cleveland,missing asae exhibitor emails value asshat,0
deluge,NaN,meditationbymsg pal got method meditation youp maggot deluge divine blessing happy peaceful life,0
deluge,newcastle,im uk deluge canadian themed tops aroundthe timing perfect believe mad,1
deluge,NaN,tomorrow internet day months look forward deluge stuff ive avoiding downright lie,0
deluge,NaN,novalismi joseph mallory william turner shade darkness evening deluge clica sul title,0
deluged,texas,getting tons telemarketing calls cell phone ive deluged,0
deluged,lydeard,thewesterngaz im sure shop deluged local children wanting buy,0
deluged,NaN,businesses deluged invoices stand colour shape likely rise pay pile,0
deluged,karachi,glimpses hyderabad deluged heavy rainfall,1
deluged,colo,businesses deluged invoices stand colo shape likely rise pay pile,0
deluged,NaN,matter weeks amazons going deluged poorly written indie dystopian fiction teens escaping blood farms,0
deluged,NaN,businesses deluged invoices stand colour shape likely ris tothe pay pile,0
deluged,NaN,businesses abe deluged invoices stand colour shape likely rise payable,0
deluged,london,deluged low selfimage quiz,1
deluged,NaN,businesses deluged invoices stand colour shaped likely rise pay pile,0
deluged,florida,lisatoddsutton reason bring biz running senate murphy republican deluged junk mail,0
deluged,NaN,deluged low selfimage quiz,0
deluged,wellington,thesewphist holds address fuckfacewineisdumbcom going deluged spam meant,0
deluged,NaN,tarp protecting outfield moved infield getting deluged,1
deluged,NaN,businesses deluged inroicesmake stand colour shape likely rise pay pile,0
deluged,libya,eu states squabble immigration france eurotunnel deluged migrants dead thousands storm tunnel,1
deluged,NaN,businesses deluged invoices stand colour shame likely rise pay pile,0
deluged,NaN,businesses deluged invoices stand colour shape isllikely rise pay pile,0
deluged,NaN,businesses deluged invoices stand colour shape likely rise e pay pile,1
deluged,NaN,accionempresa yous department commerce deluged months com gerenciatodos,0
deluged,newcastle,feel deluged low selfimage quiz,0
deluged,NaN,businesses deluged invoices stand got color shape likely rise pay pile,0
deluged,NaN,businesses aredeluged invoices y urs stand colour shape likely rise pay pile,0
deluged,los angeles,valdes forgive bit testy deluged hatred amp lost patience,0
deluged,pakistan,news alerts glimpses hyderabad deluged heavy rainfall,1
deluged,NaN,hour savour prolong physical intensity feelings deluged y sigue,0
deluged,NaN,come flying ant day capital deluged annual swarm winged insects,1
demolish,washington,rand pals debate strategy wouldemolish bad ideas point maybe em,1
demolish,nigeria,government demolish illegal structures international conference centre,0
demolish,NaN,government demolish illegal structures international conference centre state government app,0
demolish,NaN,silver architects won permission demolish birmingham latest tower replace citys tallest building,0
demolish,NaN,demolish createdunique kerenserpa arianareed,0
demolish,NaN,state government appears set recover portion international conference ce badotweet,0
demolish,NaN,kirin listening demolish barthubbuch week wait bait patriot hater coworkers brady discussion,0
demolish,NaN,ugh hungry im going demolish food,0
demolish,NaN,demolishdeep space toffee charmeuse clothesless precisionistic vestment soda,0
demolish,NaN,government demolish illegal structures international conference centre,0
demolish,nigeria,government demolish illegal structures international conference centre,1
demolish,NaN,xgninfinity ronincarbon haha mutual host preset bal names radar demolish,0
demolish,south africa,yea im going demolish boundaries unconsciously set negative thoughts,0
demolish,NaN,midget demolish respect,0
demolish,michigan,set goals demolish fitness inspiration,0
demolish,NaN,set goals amp demolish,0
demolish,american samoa,abbswinston zionist terrorist demolish palestinian structures jordan valley,1
demolish,georgia,mariomaraczi im watching right freaked est fight demolish guy,0
demolish,NaN,think aka bom dont come urban demolish buildings assembly member warns dom emmanuel,0
demolish,NaN,read remains favorite articles lets like demolish laundry,0
demolish,london,imagine having root demolish,0
demolish,NaN,absurdly ridiculous mens fashion demolish manhood,0
demolish,london,far right racist avigdorliberman calls destruction susie previously called beheadings,1
demolish,london,demolish right,0
demolish,napa,postal service agrees sell demolish downtown building,0
demolish,lagos,news update government demolish illegal structures international conference centre daily post,0
demolish,NaN,completed quest wouldemolish marlo android game tribe androidgames gameinsight,0
demolish,oklahoma,jollyjinu said terrorist bari ok demolish house todayhave right revenge,0
demolish,NaN,think businessman demolish community centre build condos foiled troupe multiracial breakdance,0
demolish,NaN,counter league game brianna happened demolish ad totally appreciate people play,0
demolish,NaN,think going demolish drakes house ghostwriting shit know rihanna lives door,1
demolish,gummy,added video youtube playlist dan arin demolish giant gummy bear grumpout,0
demolish,NaN,nah truly demolish ur partners face upstart dribbling nostrils stop mask urself worth embarrassment,0
demolish,NaN,charming demolish falling state engineers opinion telangana,0
demolished,NaN,beastie tapas evening good folk aunties demolished,0
demolished,new jersey,tribe demolished ball,0
demolished,indiana,bought coz jar peanut butter getting demolished,0
demolished,boston,colts demolished patriots like whine ifl integrity cantmakeitup patriotsnation,0
demolished,canada,flunkies makes feel better im level demolished,0
demolished,idaho,angusmacneilsnp case yes utterly demolished utterly id embarrassed bring indy,0
demolished,NaN,stiiilo got video demolished,0
demolished,toronto,got gamer troll demolished kid philly toronto mob upset backtrack charged,1
demolished,uk,church media media silent papicongress demolished house journo uk prank,1
demolished,NaN,man cam demolished plate ass hungry,0
demolished,NaN,finally demolished spring property sat vacant saddlebrooke,0
demolished,british columbia,absolutely demolished sounders start finish,0
demolished,NaN,lol meerkat fucked demolished periscope facebook live streaming,0
demolished,NaN,demolished snowball,0
demolished,newcastle,finally demolished spring property sat vacant saddlebrooke,0
demolished,israel,splottdave teampalestina palestinian homes demolished israel israeli home demolished potus,1
demolished,china,china demolished sent fucking stone age,0
demolished,dublin,home suites offices coming salves bistro site salves bistro soon demolished,0
demolished,west bank,busness latest palestine amp israel palestinians kidnapped west bank heron home demolished,1
demolished,NaN,davidfernandez theplace trump absolutely demolished general election,0
demolished,NaN,finally demolished spring property sat vacant saddlebrooke,0
demolished,birmingham,stallion beast totally demolished genius beautiful film people agreed,1
demolished,phoenix,wouldangerous property downtown phoenix demolished,0
demolished,catalonia,demolished personal best,0
demolished,NaN, year old ring fort demolished,0
demolished,jackmulholland,jackmulholland think marquis carlos amp charlies finally dublin sadly demolished,0
demolished,NaN,demolished palestinian village comes life,1
demolished,paterson,homes demolished unrecognized arab village international middle east media center,1
demolition,NaN,epa begins demolition homes toxic area buffalo,1
demolition,NaN,davidvonderhaar loved little demolition boy,0
