keyword,location,text,target
flood,united states,flood advisory issued august pm eat news,1
flood,NaN,survived plague floated flood peeked heads mud ones immune deafening bells god survive,0
flood,new york,spot flood combo inch w curved cree led work light bar ex offload fog lamp real,0
flood,westchester county,flood prone waterways westchester county eligible millions state aid network,1
flood,myanmar,chinese rescue team arrives myanmar help flood victims sideway,1
flood,knoxville,flood advisory issued august pm cut august pm cut news urban weather,1
flood,new york, cree led work light bar alloy spot flood combo diving offload boat ready,0
flooding,rock springs,rock springs residents living elk street continue battle flooding issues mondays rain storm,1
flooding,vietnam,cuban leader extends sympathy vietnam flooding,1
flooding,petersburg,business sponge docks washed rain flooding,1
flooding,NaN,warlordqueen thrusts little jams cock deep inside flooding womb pussy hot thick cum,0
flooding,midsouth midwest,severe thunderstorms flash flooding possible midsouth midwest weather environment climate nature,1
flooding,huntsville,radar update widespread showersstorms moving areasminor flooding possible hung,1
flooding,canada,tips prevent basement leaks create control joints eliminate random cracking homeimprovement flooding,0
flooding,NaN,flooding,1
flooding,NaN,adorableappple reported flooding po area mada,0
flooding,NaN,flooding kills displace million pakistan daily news amp analysis yovani,1
flooding,NaN,flooding kills displace million pakistan daily news amp analysis,1
flooding,laos,laos flooding villages underwater world vision responding,1
flooding,uk,floods floods british trekkers rescued amid flash floods himalayas group british flooding,1
flooding,NaN,slopeofhope maybe plan dilute safely start charging longs come flooding,0
flooding,vietnam,cuban leader extends sympathy vietnam flooding,1
flooding,NaN,ill hotel info people flooding notifications asking info,0
flooding,NaN,waves flooding shore find way home anymore look,1
flooding,honolulu,flooding occurs home stop mold growth proudgreenhome,1
flooding,NaN,flooding tracks caused derailment sa subcontinent subcontinent,1
flooding,new york,chinese flooding ny market like,0
flooding,NaN,obama keeps iraqi christian asylum seekers detention flooding yous unscreened muslims clothesline,1
flooding,california,grateful support flooding netkicorp dinner guests thank,1
flooding,alabama,flash flooding madison valley,1
flooding,brazil,tremaine soon start flooding comment section come brazil comments,0
flooding,NaN,year lot drums flooding janice im falling,0
flooding,NaN,bbcengland burst water main causes major flooding birmingham hospital omg,1
flooding,vietnam,heavy rainfall flooding northern vietnam situation report,1
flooding,ohio,crabbycale oh god memories flooding,0
flooding,new york,flood disaster burst water pipe floods apartments cha senior center ny nyburst water pipe floods,1
flooding,NaN,let look tom feels flooding,0
flooding,myanmar,myanmar assisting thousands worst flooding decades hits parts myanmar,1
flooding,ocean city,residents central ocean city heard engineers flood mitigation options tuesday,1
flooding,NaN,wen finally girl want im flooding wit pics tho,0
flooding,NaN,kilo flooding mad decent,0
flooding,myanmar,monsoon flooding kills dozens myanmar prompting calls help,1
flooding,travis county,memorial unveiled travis county deputy killed sept flooding travis county sheriff greg hamilton joined,1
flooding,pakistan,flooding kills displace million pakistan people killed nearly lakhs,1
flooding,india,thank soo flooding notifications fella parsholics superb amp jus soo awesomelove love frvrgrateful,0
floods,NaN,slip sliding away flash floods info writers tony nester sonoranrattler writingtips,1
floods,america,bringing tornadoes floods bringing climate change god america plaguing farrakhan quote,1
floods,myanmar,myanmar flooding heavy monsoon rains month july caused flooding flash floods lands,1
floods,india,india people taken shelter relief camps government set floods,1
floods,alberta,sharper worry im sure climate hail floods tornados alberta amp ontario im sure gods mad,1
floods,NaN,ictyosaur thought wif moment months degree heat flash floods,1
floods,NaN,granted like half town floods rains,1
floods,brisbane,madonnamking spa site multiple story high rise buildings low density character residential area floods,0
floods,canada,cyberdemon hope mountain dew erodes throat floods lungs leaving drown death,1
floods,michigan,disaster group stunned floods,1
floods,london,person amp reckon dying brain floods dot causing relive life real time simulation,0
floods,NaN,remembered old song heared years words carry floods memories priceless,0
floods,california,floods fishing finally sunshine amp fab deals robertsons anniversary sale lauren paints beautiful life,0
floods,NaN,flood disaster bengal floods matata banerjee blames doc bop claims state failed use economic,1
floods,myanmar, dead floods myanmar naypyidaw aug prenda latina death toll rose today myanmar,1
floods,philippines,typhoon soudelor approaches killed missing floods philippines abcchicago,1
floods,new jersey,casewrites rains flash floods desert grief taxes,1
floods,new york,download itunes floods glory luiz santos jazz art music,0
floods,new zealand,contactenergy yep floods clyde dam releasing bit water speccy ev charging way,1
floods,NaN,agenda floods kill animals birds,1
floods,NaN,hope rains weekend hope floods portals sentient,0
floods,lagos,apc chieftain tasks dickson numb floods donation bagels,1
floods,panty island,pages yellow warning panty island guitars negros possible floods bowling areas amp landslides mountainous areas,1
floods,NaN,hourfamine bangladesh government declared floods emergency worldvision continue,1
floods,NaN,nearly thousand people affected floods paraguay,1
floods,NaN,et bengal floods matata banerjee blames doc bop claims state failed use relief funds flood,1
floods,pakistan,allah help suffering pakistan floods families dua,1
floods,myanmar,children myanmar face wouldouble catastrophe floods hit,1
floods,new york,love drake floods instagram makes feel real tune like sun,0
floods,america,bringing tornadoes floods bringing climate change god america plaguing farrakhan quote,0
floods,myanmar, die myanmar floods affected,1
floods,philippines,typhoon soudelor approaches killed missing floods philippines typhoon,1
floods,NaN,memphis floods,1
floods,NaN,floods damage death asia media content ,1
floods,delaware,gas soon maintenance ends floods servers servers destroyed extreme load maintenance starts anew,0
floods,america,bringing tornadoes floods bringing climate change god america plaguing farrakhan quote,0
forest fire,NaN,e particulatebreak solid combust fossil fuel voltaic active forest fire biological vocpetroleum chi bacteria decomposition,1
forest fire,west beaverton,careful lives west beaverton forest grove rapidly spreading fire heading east,1
forest fire,shelby county,added video youtube playlist ori bind forest ep fire death,1
forest fire,NaN,careless match start forest fire takes box start campfire,1
forest fire,pennsylvania,little forest fire wardens,1
forest fire,concord,fire pish national forest grows acres,1
forest fire,california,ashenforest floorburnt manzanita amp timber johnson fire ridge forest road routecomplex,1
forest fire,NaN,sweetyoung runs setting forest fire bites shit neck,1
forest fire,NaN,hornybigbadwolf sets forest fire,1
forest fire,romania,liked youtube video cole fire squad forest hills drive,0
forest fire,california,view smoke column rising south end blake fire forest road routecomplex,1
forest fire,NaN,starts forest fire,1
forest fire,asheville,fire pish national forest grows acres,1
forest fire,NaN,grill school function grills going pretty forest fire inbetween work,0
forest fire,NaN,p watch forest fire smoke lifted nuff run tthe pet store home,1
forest fire,los angeles,having forest fires socal fire watch ybtheprophet realhiphop,1
forest fire,NaN,yous forest service firefighter david rahl died frog fire modoc national forest temporarily reassigned,1
forest fire,NaN,uses acronym united states fire service,0
forest fire,atlanta,careless match start forest fire takes box start campfire,0
forest fires,NaN,prevent forest fires,1
forest fires,NaN,naturaldisasters california fires rage forest service sounds alarm rising wildfire costs,1
forest fires,NaN,ducks big flat feet stamp forest fires elephants big flat feet stamp flaming ducks,0
forest fires,alberta,gilmanrocks wow rest summer usually worry forest fires calgary hours away,1
forest fires,california,california fires rage forest service sounds alarm sharply rising wildfire costs,1
forest fires,NaN,little concerned number forest fires living,1
forest fires,alaska,nycdivorcelaw trump climate denier algae bloom pacific calf alaska seaweed caribbean forest fires snowball income,1
forest fires,montana,forest service spends gto budget fighting fires,1
forest fires,NaN,cartoon bears knowledge forest fires toilet paper,0
forest fires,NaN,year forest service spent half annual budget fighting fires climatechange,1
forest fires,california,california fires rage forest service sounds alarm rising wildfire costs,1
forest fires,NaN,reddit lightning sparks new fires boise national forest rstormcoming,1
forest fires,indonesia,spread conflict parboil sparked increase fires destroying forest indonesia,1
forest fires,NaN,photo blue forestfires source,1
forest fires,NaN,im cook smokey bear saving forest fires face ass,0
forest fires,NaN,forest fires amp dying salmon time act deny climate change nightmares coli cannoli cannoli,1
forest fires,NaN,tales trees deep water loving lake tahoe forest fires,0
forest fires,idaho, progress boise forest fires,1
forest fires,california,group florida forest service firefighters deployed california help contain fires details ,1
forest fires,NaN,pray east coast forest fires pray pray rain,1
forest fires,british columbia,bluejack braves angels instead dumping water send british columbia help forest fires,1
forest fires,NaN,heartdisease yous forest service says spending half budget fires,1
forest fires,texas,pharrell prevent forest fires,0
forest fires,NaN,climate consequences yous forest service says spending half budget fires,1
forest fires,NaN,yous forest service says spending half budget fires,1
forest fires,indiana,property losses northern california wildfire nearly double yahoonews,1
forest fires,portland,incite update rogue riversiskiyou national forest fires rogue riversiskiyou area,1
forest fires,vancouver,forest fires delay abbyairshow officials good thing,1
forest fires,pennsylvania,yous forest service says spending half budget fires ian simpsons,1
forest fires,NaN,campsite recommendations toilets shower pub fires kids pizza shop forest pretty stream midges snakes thanks,1
forest fires,NaN,ur friend talking forest fires forest tells drop ur mix tape straightfire,1
forest fires,sacramento,firefighting consumes forest service budget sparks political clash forest service report cites increasing cost,1
hail,bmurph,great michigan technique camp big thanks bmurph hailyoutsey termnr blue wrestle,1
hail,NaN,avenged sevenfold hail king,0
hail,NaN,hail shadow hybrid mix feat mike sister youtube youtube,1
hail,NaN,tremblayeh like big hail lie sirmixalot,0
hail,arkansas,lik issues severe thunderstorm warning wind mah hail sharp ar till cut,1
hail,hattiesburg,great wouldawgs dak jak hail state,0
hail,arkansas,strong thunderstorm miles north laptop moving se mah large hail wind gusts mah poss arw,1
hail,united states,rank issues severe thunderstorm warning wind mah hail buckingham stokes till aug eat,1
hail,NaN,thank posting rain hail outside idea guys,0
hail,dagenham,choo hail pumpkin king,0
hail,NaN,cue storm massive wind hail power outage wii davidson county,1
hail,NaN,hereto enjoy hopefully epic hail storms going,0
hail,NaN,strong thunderstorm miles north laptop moving se mah large hail wind gusts mah poss arw,1
hail,florida,hail lady cheryl reasons obsessed cheryl cole,0
hail,NaN,kmactwn meaganerd looks like bowl weather cereal new kellogg sugar hail stays crunchy milk,0
hail,NaN,hail mary grace lord thee blessed art thou women blessed fruit thy,0
hail,NaN,seen fahlowcw hail queen mtvhottest justin bieber,0
hail,NaN,modnao hail ruining plus car gotten killer migraine lost glasses,1
hail,NaN,fazerain hail cloud,0
hail,mah,new warning central hills hail mah winds affecting surges later tonight kotaweather,1
hail,NaN,hailed man kno im,0
hail,NaN,hail pic,0
hail,NaN,heavy rain lightning overhead abridge calgary melt hailyycstorm storm,1
hail,calgary,heyitsepark heavy rain hail,1
hail,calgary,weathernetwork comes hail,1
hail,NaN,flow coming atcha boston golfball sized hail yesterday sunny amazing skies today backchat,0
hail,indianapolis,central mass fruit trees escape heavy damage wind hail,1
hail,mah,new warning central hills hail mah winds affecting surges later tonight kotaweather,1
hail,wyoming,unr continues severe thunderstorm warning wind mah hail ltto weston wy custer fall river pennington till,1
hail,california,kevin tan says hail chefs green pastures features sustainable organic cooking,0
hail,nevada,hail new caesars,0
hail,calgary,calgary pounded hail second day storms,1
hail,NaN,darkndtatted pull holmes,0
hail,nebraska,hires doppler showing storm ne edmond severe hail lymph wind possible,1
hail,wyoming,unr issues severe thunderstorm warning wind mah hail weston wy custer fall river lawrence meade pennington,1
hailstorm,calgary,outdoor pestering calgaryfringe mothernature hailstorm rain yycfringe billiard,1
hailstorm,NaN,haleywhaley hailstorm hey secret trick gems clash oceans check profile,0
hailstorm,calgary,nice job calgary transit,0
hailstorm,newton centre,freak boston hailstorm produces hailstorm business autonomy repair specialists peterhowenecn tonight neck,1
hailstorm,NaN,omg nixon lives richard nixon tricky dicky right picture hiding calgary,1
hailstorm,NaN,allthe user summons hailstorm lasting turns damages pokemon ice type,0
hailstorm,NaN,calgary news weather traffic august ,0
hailstorm,calgary,adriasimon hailstorm day round yycstorm,1
hailstorm,NaN,wicked weather rolls calgary surrounding areas,1
hailstorm,calgary,got love summer calgary hailstorm crazyweather,1
hailstorm,tokyo,severe weather rare hailstorm pummel boston,1
hailstorm,washington state,free hailstorm maxi,1
hailstorm,NaN,sworn defend proven friends house hailstorm,0
hailstorm,massachusetts,twin storms blow calgary ,1
hailstorm,calgary,summer heat drives bobcats calgary backyards ,1
hailstorm,alberta,ready close error nope notgoingoutinthat hailstorm alberta hellonwheelsamc hoffans talkinghell,1
hailstorm,calgary,ig hailing storm hail hailstorm haildamage yycweather calgary captureyyc alberta stop,1
hailstorm,calgary,summer heat drives bobcats calgary backyards ,1
hailstorm,calgary,sadly tent fly survive hailstorm tears roof water tent,1
hailstorm,boston,boston yesterday intense hailstorm post rcityporn,1
hailstorm,NaN,favorite text,0
hailstorm,canada,canada hailstorm flash flooding slam calgary knocks power ask customers,1
hailstorm,grand rapids,going break work got right carlilescanoelivery lovemyjob,0
hailstorm,colorado,severe hailstorm progress northeast logan county cow,1
hailstorm,NaN,councils hailstorm,1
hailstorm,boston,scared leave car trees storm jamaicaplain boston hailstorm,1
hailstorm,NaN,calgary news weather traffic august ,0
hailstorm,los angeles,stephen ave flower pots got little ripped hailstorm today storm calgary iamdowntown,1
hailstorm,worst city,grow calgary avoids worst city wicked weather ,1
hailstorm,boston,photo scared leave car trees storm jamaicaplain boston hailstorm,1
hailstorm,calgary,calgary transit reviewing policy leaving hundreds commuters stranded hail,1
hailstorm,ab, passengers abandoned let station tuesdays hailstorm yycstorm storm,1
harm,u.s. virgin islands,quality metrics penalties harm patient care pops primary care physicians generally hold positive vi,0
harm,massachusetts,tareksocal think lot celebrities treat pal harm,0
harm,NaN,sticks stones break bones words harm,0
harm,NaN,sig tries harm cupcake fucking hunt end earth harrybecareful,0
harm,queensland,vanderbilt harm,0
harm,kansas,leedsrouge love picked playing worth fifth harmed ink listen amp vote,1
harm,cleveland,imagine doctor treating ebola patient placing harms way,1
harm,NaN,right annoyed actually hung mean harm audaciousspunk,0
harm,NaN,ive burned self harm way im dumbass allowed fire way,0
harm,NaN,concur longer spend child harm mak,0
harm,NaN,people tagging self harm fucking,0
harm,kansas,dinallyhot love picked playing worth fifth harmed ink listen amp vote,0
harm,NaN,pray harm members isis pray experience liferebooting love god amp pals gods mindblowing final act,0
harm,buffalo,safety improvements route buffalo harm good,0
harm,NaN,inner man wayward route harm spent replacing online surveys qzloremft,0
harm,NaN,happens fucking fly midlife hours away meampbeat crap tries harm boys otratmetlife,0
harm,gotham city,escape bullets harm harms know pain know pain share like,1
harm,seattle,standardized tests harm children color parentsacrossam ballgames,0
harm,NaN,know plans declares lord plans prosper harm plans,0
harm,NaN,laurenmiller harm,0
harm,NaN,angelstar obama feel responsible bringing illegals family protected harm feeling heart,0
harm,texas,ive meaning harm best way fit,0
harm,england,vilelunar trickshot regular controller fucking infinite fading harm,0
harm,south carolina,sex workers credit card bans online ads harm good,0
harm,england,harm angel,0
harm,NaN,harm boys taken immediately security fans real quick,0
harm,NaN,security cards good dare let harm harry otrametlife,0
harm,ohio,blogged picture self harm scars oh stop,0
harm,NaN,wowsavannah harm collectibles,0
harm,NaN,interview actor randy irwin ask harm,0
harm,kansas,hvzlaradio love picked playing worth fifth harmed ink listen amp vote,0
harm,NaN,got world bros want harm come way going lil upset right,0
harm,NaN,wwexdreamer talk harm self way shape form care saw right better,0
harm,virginia,malistkiss sunni continue believe righteous continually harm ships defeats ideals islam,1
harm,NaN,newsbuffalo yes lot harm good guardrails big problem school starts,0
harm,portland,spacewolverine harm foul somebody needed,0
harm,NaN,tastemycupcakee lmfaooo hell nah yo ass thought,0
harm,NaN,self harm im angry tag scars tumblr jesus christ want triggered,0
harm,NaN,rjg iki feel like movies harm good look stereotypical annd colorist prevalent sort,0
harm,california,quality metrics penalties harm patient care pops primary care physicians generally hold positive views,0
harm,nebraska,politicians false allegations attack plannedparenthood amp harm women fooled standwithpp,0
hazard,NaN,classycolkett thorian hazard permanent gladbach summer lao,0
hazard,australia,lifestyle makes sick baby clothes deemed hazard,0
hazard,NaN,longbreastyat yeah think elite think hazard better player,0
hazard,alameda,choking hazard prompts recall kraft cheese singles,1
hazard,london,seeing hazard beard like,0
hazard,arizona,hazard pay,0
hazard,united kingdom,liked youtube video chaboyyhd battlefield funny moments dukes hazard undercover soldier,0
hazard,NaN,phiddleface choking hazard die,0
hazard,NaN,road hazard cascade red childress,0
hazard,NaN,road closures remain effect hazard trees falling tree torching uphill runs fire forest service road remains close,1
hazard,idaho,di maria left dear muff hazard maria argument hazard way better id,0
hazard,NaN,davis drug guide nurses judith hopper degli april hazard talleyrand,0
hazard,NaN,eden hazard hockey,0
hazard,chicago,confirmed sanchez hazard blase rest season,1
hazard,tokyo,thatpersianguy youngsafe eden hazard harden spot flopping identical,0
hazard,NaN,rate hazard highly fanboys worst accounts twitter,0
hazard,NaN,dannyraynard bad personally rid hazard guero better striker berating,0
hazard,pleasanton,choking hazard prompts recall kraft cheese singles,0
hazard,NaN,breaking arsenals hector bulletin arrested questioning disappearance eden hazard,0
hazard,virginia,freak accident sure looking blame maybe remember player broke leg cuz cart end zone common sense,0
hazard,NaN,december court dismissed group charge rape victims saying getting raped occupational hazard military isis,0
hazard,NaN, bow emergency warning hazard switch button poem d,0
hazard,kenya,kenya news chelsea talisman eden hazard keen match cristian ronaldo lionel mess impasto,0
hazard,chicago,biggest lead hazard new england history yeah let nail guys,0
hazard,NaN,deaddreamer fire safety hazard,1
hazard,massachusetts,precious cargo onesie recalled choking hazard,0
hazard,NaN,tomdean alright hazardwillian going shifted easily,0
hazard,NaN, hazard high traffic area deans bridge red,1
hazard,NaN,battlefield funny moments dukes hazard undercover soldier mav youtube,0
hazard,hawaii,londonfire hi email people use report thing think fire hazarddangerous,1
hazard,uk,tipster previews chelsea swansea amp double chelsea hazard,0
hazard,NaN,arianagrande girl licking public donuts health hazardous jail,0
hazard,NaN,fair best attacking wingers prem hazard willian basically start game ,0
hazard,NaN, hazard high traffic area wrightsboro red,1
hazardous,nashville,wholesale gon rep hit costs hazardous wholeteam wholesaleent,0
hazardous,NaN,eb line update offloading hazardous material going slower expected road stay closed tomorrow,1
hazardous,taiwan,taiwan grace expect large rocks trees mud unstable candor saturated land slide hazardous hillymountain areas,1
hazardous,NaN,dah issues hazardous weather outlook,1
hazardous,NaN,jax issues hazardous weather outlook,0
hazardous,NaN,risk assessment optimization routing hazardous waste collection sustainable environmental,0
hazardous,united states,jax issues hazardous weather outlook,1
hazardous,NaN,gimp dangling piercing crystals potentially hazardous eyes,0
hazardous,NaN,foodscare offersgo nestleindia slips loss magginoodle ban unsafe hazardous humanconsumption,1
hazardous,NaN,tribal slap world pres recognize hazardous waste multidimensi,0
hazardous,british columbia,skinny jeans hazardous health socialnews,1
hazardous,holland,recycling nonhazardous chemicals holland continually strives maintain ecofriendly existence,1
hazardous,NaN,dam gas slap world pres recognize hazardous waste multidimensional,1
hazardous,NaN,fear quarrels seek hazardous adventures,0
hazardous,gainesville, hazardous weather outlook hazardous weather expected time,0
hazardous,united states,jal issues hazardous weather outlook,1
hazardous,muntinlupa city,hearitfrompa plus help campaign warn public hazardous keratin treatments brazilian blowout copycats,0
hazardous,united states,meg issues hazardous weather outlook,1
hazardous,muntinlupa city,hearitfrompatty plus help campaign warn public hazardous keratin treatments brazilian blowout copycats,0
hazardous,NaN,caution breathing hazardous health,1
hazardous,oregon,possible sneak hospital stab hazardous needle inject crazy disease veins die,0
hazardous,NaN,theblackshag dannyoneil toxiccancerdiseasehazardous wastenoxious,1
hazardous,NaN,caution breathing hazardous health,0
hazardous,memphis,meg issues hazardous weather outlook,1
hazardous,NaN,getting hazardous getting world alive,1
hazardous,NaN,joshlado tweeting driving joshua typos hazardous,0
hazardous,NaN,foodscare offersgo nestleindia slips loss magginoodle ban unsafe hazardous humanconsumption,1
hazardous,NaN,versace emergency auto kit weather unsafe hazardous rushhour gridlock jumperca,1
hazardous,NaN,mar issues hazardous weather outlook,1
hazardous,portland,hazard hazardous condition fly terwilliger bled portland portland police pp pdx,1
hazardous,canada,skinny jeans hazardous health socialnews,1
hazardous,delhi,foodscare offersgo nestleindia slips loss magginoodle ban unsafe hazardous humanconsumption,0
hazardous,NaN,pod special slap world pres recognize hazardous waste multidimensi,1
hazardous,united states,dah issues hazardous weather outlook,1
hazardous,british columbia,skinny jeans hazardous health socialnews,1
heat wave,fort worth,startelegram homeless vulnerable north texas heat wave,1
heat wave,NaN,rawfoodbliss im middle humid heat wave patch forehead flared olive oli extract tabs olive oil,0
heat wave,NaN,heat advisory effect thursday building heat wave increasing humidity law,1
heat wave,massachusetts,share comment alex lightman evidence,0
heat wave,iran,apocalyptic iran heat wave nearly breaks world record,1
heat wave,japan,japan heat wave intensifies death toll surges ,1
heat wave,NaN,heebsterrr remember heat wave year went bruh ac,0
heat wave,karachi,waseembadami condemning deaths heat wave karachi allah patience heirs,1
heat wave,london,frightening happening weather middle east,1
heat wave,NaN,creationsbykole cork city ireland got degrees daythat heat wave haha,1
heat wave,london,hollywarnexx mini heat wave spaz,1
heat wave,netherlands,archer weather ltpgtan unrelenting dangerous heat wave expand south central united states,1
heat wave,NaN,use cool mideast heatwave rain watch latest video ncis issues warning thundering rain poor visibility,1
heat wave,spain,klarajoelsson seen bummer heat wave tho doc prefer rain,1
heat wave,NaN,heat wave squad revitup bizzare,1
heat wave,dallas,jackson longest streak tripledigit heat forecast dallas,1
heat wave,pennsylvania,read forecast longest streak tripledigit heat happens,1
heat wave,texas,wfaaweather pete heat wave pass going mid month frisco boy scouts canoe trip okra,1
